{
  "schemaVersion": 1,
  "transcriptId": "t1_cdb084fb20edf45eb618b16d",
  "sourceId": "youtube:5paRa6E5rCM",
  "language": "en",
  "pipeline": {
    "modelId": "mlx-community/parakeet-tdt-0.6b-v3",
    "modelRevision": "ed2b7e8c15f9aaa0b5772e2efb986255eaef7e15",
    "runtime": "parakeet-mlx 0.5.1",
    "generatedAt": "2026-08-31T15:07:25.475Z"
  },
  "segments": [
    {
      "segmentId": "youtube:5paRa6E5rCM:segment:1",
      "startMs": 240,
      "endMs": 7840,
      "verbatim": "Chinese resellers are offering clawed tokens at 70 to 90 percent below official anthropic prices.",
      "display": "Chinese resellers are offering clawed tokens at 70 to 90 percent below official anthropic prices.",
      "search": "chinese resellers are offering clawed tokens at 70 to 90 percent below official anthropic prices.",
      "confidence": 0.806
    },
    {
      "segmentId": "youtube:5paRa6E5rCM:segment:2",
      "startMs": 7840,
      "endMs": 10720,
      "verbatim": "Now, I don't even know what to do with that statement.",
      "display": "Now, I don't even know what to do with that statement.",
      "search": "now, i don't even know what to do with that statement.",
      "confidence": 0.906
    },
    {
      "segmentId": "youtube:5paRa6E5rCM:segment:3",
      "startMs": 10720,
      "endMs": 12880,
      "verbatim": "What are we even talking about?",
      "display": "What are we even talking about?",
      "search": "what are we even talking about?",
      "confidence": 0.87
    },
    {
      "segmentId": "youtube:5paRa6E5rCM:segment:4",
      "startMs": 12880,
      "endMs": 15520,
      "verbatim": "There's a black market for tokens?",
      "display": "There's a black market for tokens?",
      "search": "there's a black market for tokens?",
      "confidence": 0.807
    },
    {
      "segmentId": "youtube:5paRa6E5rCM:segment:5",
      "startMs": 15520,
      "endMs": 17200,
      "verbatim": "Yes, yes, there is.",
      "display": "Yes, yes, there is.",
      "search": "yes, yes, there is.",
      "confidence": 0.809
    },
    {
      "segmentId": "youtube:5paRa6E5rCM:segment:6",
      "startMs": 17200,
      "endMs": 25200,
      "verbatim": "There's an entire economy built around this black market, this gray market, this shadow API economy.",
      "display": "There's an entire economy built around this black market, this gray market, this shadow API economy.",
      "search": "there's an entire economy built around this black market, this gray market, this shadow api economy.",
      "confidence": 0.862
    },
    {
      "segmentId": "youtube:5paRa6E5rCM:segment:7",
      "startMs": 25200,
      "endMs": 32560,
      "verbatim": "So we're actually gonna go over who's using it, why they're using it, how this actually even works, how do they have it at 70 to 90% off?",
      "display": "So we're actually gonna go over who's using it, why they're using it, how this actually even works, how do they have it at 70 to 90% off?",
      "search": "so we're actually gonna go over who's using it, why they're using it, how this actually even works, how do they have it at 70 to 90% off?",
      "confidence": 0.906
    },
    {
      "segmentId": "youtube:5paRa6E5rCM:segment:8",
      "startMs": 32560,
      "endMs": 34400,
      "verbatim": "Because I mean that sounds kind of nice.",
      "display": "Because I mean that sounds kind of nice.",
      "search": "because i mean that sounds kind of nice.",
      "confidence": 0.825
    },
    {
      "segmentId": "youtube:5paRa6E5rCM:segment:9",
      "startMs": 34400,
      "endMs": 35280,
      "verbatim": "Did they solve?",
      "display": "Did they solve?",
      "search": "did they solve?",
      "confidence": 0.511
    },
    {
      "segmentId": "youtube:5paRa6E5rCM:segment:10",
      "startMs": 35280,
      "endMs": 36880,
      "verbatim": "They solve something we don't understand.",
      "display": "They solve something we don't understand.",
      "search": "they solve something we don't understand.",
      "confidence": 0.952
    },
    {
      "segmentId": "youtube:5paRa6E5rCM:segment:11",
      "startMs": 36880,
      "endMs": 42800,
      "verbatim": "And also, I'm gonna toss my little hat into the ring and I'm gonna give you a reason why I think things are as cheap as they are.",
      "display": "And also, I'm gonna toss my little hat into the ring and I'm gonna give you a reason why I think things are as cheap as they are.",
      "search": "and also, i'm gonna toss my little hat into the ring and i'm gonna give you a reason why i think things are as cheap as they are.",
      "confidence": 0.956
    },
    {
      "segmentId": "youtube:5paRa6E5rCM:segment:12",
      "startMs": 42800,
      "endMs": 46320,
      "verbatim": "I got my own little personal theory that I'll unleash at the end.",
      "display": "I got my own little personal theory that I'll unleash at the end.",
      "search": "i got my own little personal theory that i'll unleash at the end.",
      "confidence": 0.928
    },
    {
      "segmentId": "youtube:5paRa6E5rCM:segment:13",
      "startMs": 46320,
      "endMs": 53280,
      "verbatim": "Alright, so to understand this entire gray market universe, you have to understand the fundamental unit.",
      "display": "Alright, so to understand this entire gray market universe, you have to understand the fundamental unit.",
      "search": "alright, so to understand this entire gray market universe, you have to understand the fundamental unit.",
      "confidence": 0.908
    },
    {
      "segmentId": "youtube:5paRa6E5rCM:segment:14",
      "startMs": 53280,
      "endMs": 57600,
      "verbatim": "Everything is around this idea of a transit station.",
      "display": "Everything is around this idea of a transit station.",
      "search": "everything is around this idea of a transit station.",
      "confidence": 0.889
    },
    {
      "segmentId": "youtube:5paRa6E5rCM:segment:15",
      "startMs": 57600,
      "endMs": 75040,
      "verbatim": "What this is, is it goes from the great country of China and it takes in requests going to these transit stations, and then out they go to say anthropic or open AI, and then pipe the results back in back to the people behind these intelligence iron curtains.",
      "display": "What this is, is it goes from the great country of China and it takes in requests going to these transit stations, and then out they go to say anthropic or open AI, and then pipe the results back in back to the people behind these intelligence iron curtains.",
      "search": "what this is, is it goes from the great country of china and it takes in requests going to these transit stations, and then out they go to say anthropic or open ai, and then pipe the results back in back to the people behind these intelligence iron curtains.",
      "confidence": 0.84
    },
    {
      "segmentId": "youtube:5paRa6E5rCM:segment:16",
      "startMs": 75040,
      "endMs": 81120,
      "verbatim": "These countries that are not allowed to access open AI or anthropic because of government restrictions.",
      "display": "These countries that are not allowed to access open AI or anthropic because of government restrictions.",
      "search": "these countries that are not allowed to access open ai or anthropic because of government restrictions.",
      "confidence": 0.843
    },
    {
      "segmentId": "youtube:5paRa6E5rCM:segment:17",
      "startMs": 81120,
      "endMs": 83440,
      "verbatim": "Now you're probably thinking this this sounds like a VPN.",
      "display": "Now you're probably thinking this this sounds like a VPN.",
      "search": "now you're probably thinking this this sounds like a vpn.",
      "confidence": 0.86
    },
    {
      "segmentId": "youtube:5paRa6E5rCM:segment:18",
      "startMs": 83440,
      "endMs": 83840,
      "verbatim": "It is.",
      "display": "It is.",
      "search": "it is.",
      "confidence": 0.671
    },
    {
      "segmentId": "youtube:5paRa6E5rCM:segment:19",
      "startMs": 83840,
      "endMs": 86480,
      "verbatim": "This is exactly how a VPN effectively works.",
      "display": "This is exactly how a VPN effectively works.",
      "search": "this is exactly how a vpn effectively works.",
      "confidence": 0.933
    },
    {
      "segmentId": "youtube:5paRa6E5rCM:segment:20",
      "startMs": 86480,
      "endMs": 92640,
      "verbatim": "You from your computer make requests, it goes up to a VPN, the VPN then goes off and makes the request and funnel everything back to you.",
      "display": "You from your computer make requests, it goes up to a VPN, the VPN then goes off and makes the request and funnel everything back to you.",
      "search": "you from your computer make requests, it goes up to a vpn, the vpn then goes off and makes the request and funnel everything back to you.",
      "confidence": 0.913
    },
    {
      "segmentId": "youtube:5paRa6E5rCM:segment:21",
      "startMs": 92640,
      "endMs": 96480,
      "verbatim": "This is exactly the same thing, except for they do it through these transit stations.",
      "display": "This is exactly the same thing, except for they do it through these transit stations.",
      "search": "this is exactly the same thing, except for they do it through these transit stations.",
      "confidence": 0.92
    },
    {
      "segmentId": "youtube:5paRa6E5rCM:segment:22",
      "startMs": 96480,
      "endMs": 100640,
      "verbatim": "Now you're probably saying, well, what's the difference between a transit station and say open router?",
      "display": "Now you're probably saying, well, what's the difference between a transit station and say open router?",
      "search": "now you're probably saying, well, what's the difference between a transit station and say open router?",
      "confidence": 0.908
    },
    {
      "segmentId": "youtube:5paRa6E5rCM:segment:23",
      "startMs": 100640,